{
    "schemaVersion":  1,
    "id":  "Mob_20106_GiantRat",
    "sourceId":  20106,
    "designerName":  "쥐",
    "designerNote":  "",
    "enabled":  true,
    "localization":  {
                         "name":  "",
                         "description":  ""
                     },
    "presentation":  {
                         "sprite": "Art/Enemies/Mob_20106_GiantRat"
                     },
    "encounter":  {
                      "act":  2,
                      "grade":  "normal",
                      "difficulty":  "normal"
                  },
    "stats":  {
                  "health":  560,
                  "strength":  0
              },
    "ai":  {
               "mode":  "static",
               "patterns":  [
                                "2_Single",
                                "2_Multi_1",
                                "GiantRatSkill"
                            ]
           },
    "passives":  [

                 ]
}
